{
  "schemaVersion": 1,
  "id": "hxh-full-canon-reference",
  "name": "Hunter x Hunter: Full Canon Reference",
  "role": "reference",
  "format": "voyage-v33",
  "paths": {
    "tabs": "tabs",
    "compiledOutput": "HxH-Full-Canon-Reference.json",
    "instructions": "AGENTS.md"
  },
  "toolchain": {
    "formatProfile": "voyage-json-tabs",
    "buildProfile": "world-build-cjs",
    "validationProfiles": [
      "voyage-local-validator"
    ]
  },
  "activeProfiles": []
}
